CREATE EXTENSION toastapi;
SET search_path = pgpro_toast, public, pg_catalog;
SET default_toast_compression=pglz;
CREATE FUNCTION dummy_toaster_handler(internal)
RETURNS internal
AS '$libdir/toastapi'
LANGUAGE C;
CREATE FUNCTION dummy2_toaster_handler(internal)
RETURNS internal
AS '$libdir/toastapi', 'dummy_toaster_handler'
LANGUAGE C;
-- add_toaster()
SELECT add_toaster(NULL, NULL);
 add_toaster 
-------------
            
(1 row)

SELECT add_toaster(NULL, 'foo');
 add_toaster 
-------------
            
(1 row)

SELECT add_toaster('bar', NULL);
 add_toaster 
-------------
            
(1 row)

SELECT add_toaster('', '');
ERROR:  invalid name syntax
SELECT add_toaster('foo', '');
ERROR:  invalid name syntax
SELECT add_toaster('foo', 'bar');
ERROR:  function bar(internal) does not exist
SELECT add_toaster('dummy', 'foo');
ERROR:  function foo(internal) does not exist
SELECT add_toaster('dummy', 'dummy_toaster_handler') AS dummy_toaster_oid
\gset
SELECT :dummy_toaster_oid <> 0;
 ?column? 
----------
 t
(1 row)

SELECT add_toaster('dummy', 'foo');
ERROR:  function foo(internal) does not exist
SELECT :dummy_toaster_oid = add_toaster('dummy', 'dummy_toaster_handler');
 ?column? 
----------
 t
(1 row)

SELECT add_toaster('foo', 'dummy_toaster_handler') AS foo_toaster_oid
\gset
SELECT :foo_toaster_oid <> 0;
 ?column? 
----------
 t
(1 row)

SELECT :foo_toaster_oid <> :dummy_toaster_oid;
 ?column? 
----------
 t
(1 row)

SELECT :foo_toaster_oid = add_toaster('foo', 'dummy_toaster_handler');
 ?column? 
----------
 t
(1 row)

-- drop_toaster()
SELECT drop_toaster(NULL);
 drop_toaster 
--------------
             
(1 row)

SELECT drop_toaster('');
ERROR:  cannot find toaster with name ""
HINT:  Probably toaster does not exist.
SELECT drop_toaster('bar');
ERROR:  cannot find toaster with name "bar"
HINT:  Probably toaster does not exist.
SELECT drop_toaster('foo') = :foo_toaster_oid;
 ?column? 
----------
 t
(1 row)

SELECT drop_toaster('foo');
ERROR:  cannot find toaster with name "foo"
HINT:  Probably toaster does not exist.
CREATE TABLE tab (id int, jb jsonb, b_comp bytea, b_uncomp bytea);
ALTER TABLE tab ALTER COLUMN b_uncomp SET STORAGE external;
-- set_toaster()
SELECT set_toaster('', '', '');
ERROR:  invalid name syntax
SELECT set_toaster('foo', 'bar', 'baz');
ERROR:  relation "bar" does not exist
SELECT set_toaster('foo', 'tab', 'baz');
ERROR:  cannot find toaster with name "foo"
SELECT set_toaster('dummy', 'tab', 'bar');
ERROR:  column "bar" of relation "tab" does not exist
SELECT set_toaster('dummy', 'tab', 'id');
ERROR:  data type integer can not be toasted
SELECT set_toaster('dummy', 'tab', 'jb');
ERROR:  toaster "dummy" does not support type jsonb
SELECT set_toaster('dummy', 'tab', 'b_uncomp');
ERROR:  toaster "dummy" supports only STORAGE EXTENDED
SELECT set_toaster('dummy', 'tab', 'b_comp') = :dummy_toaster_oid;
 ?column? 
----------
 t
(1 row)

-- get_toaster()
SELECT get_toaster('', '');
ERROR:  invalid name syntax
SELECT get_toaster('foo', 'bar');
ERROR:  relation "foo" does not exist
SELECT get_toaster('tab', 'bar');
ERROR:  column "bar" of relation "tab" does not exist
SELECT get_toaster('tab', 'id');
 get_toaster 
-------------
            
(1 row)

SELECT get_toaster('tab', 'jb');
 get_toaster 
-------------
            
(1 row)

SELECT get_toaster('tab', 'b_uncomp');
 get_toaster 
-------------
            
(1 row)

SELECT get_toaster('tab', 'b_comp') = :dummy_toaster_oid;
NOTICE:  dummy
 ?column? 
----------
 t
(1 row)

-- get_toaster_id()
SELECT get_toaster_id('');
 get_toaster_id 
----------------
              0
(1 row)

SELECT get_toaster_id(NULL);
 get_toaster_id 
----------------
               
(1 row)

SELECT get_toaster_id('dummy') = :dummy_toaster_oid;
 ?column? 
----------
 t
(1 row)

SELECT get_toaster_id('incorrect_toaster_name');
 get_toaster_id 
----------------
              0
(1 row)

-- reset_toaster()
SELECT reset_toaster('', '');
ERROR:  invalid name syntax
SELECT reset_toaster('foo', 'bar');
ERROR:  relation "foo" does not exist
SELECT reset_toaster('tab', 'bar');
ERROR:  column "bar" of relation "tab" does not exist
SELECT reset_toaster('tab', 'id');
 reset_toaster 
---------------
             0
(1 row)

SELECT reset_toaster('tab', 'jb');
 reset_toaster 
---------------
             0
(1 row)

SELECT reset_toaster('tab', 'b_uncomp');
 reset_toaster 
---------------
             0
(1 row)

SELECT reset_toaster('tab', 'b_comp');
 reset_toaster 
---------------
             0
(1 row)

SELECT get_toaster('tab', 'b_comp');
 get_toaster 
-------------
            
(1 row)

SELECT reset_toaster('tab', 'b_comp');
 reset_toaster 
---------------
             0
(1 row)

SELECT get_toaster('tab', 'b_comp');
 get_toaster 
-------------
            
(1 row)

SELECT set_toaster('dummy', 'tab', 'b_comp') = :dummy_toaster_oid;
 ?column? 
----------
 t
(1 row)

SELECT get_toaster('tab', 'b_comp') = :dummy_toaster_oid;
NOTICE:  dummy
 ?column? 
----------
 t
(1 row)

SELECT reset_toaster('tab', 'b_comp');
 reset_toaster 
---------------
             0
(1 row)

SELECT get_toaster('tab', 'b_comp');
 get_toaster 
-------------
            
(1 row)

SELECT set_toaster('dummy', 'tab', 'b_comp') = :dummy_toaster_oid;
 ?column? 
----------
 t
(1 row)

-- drop_toaster()
SELECT drop_toaster(NULL);
 drop_toaster 
--------------
             
(1 row)

SELECT drop_toaster('');
ERROR:  cannot find toaster with name ""
HINT:  Probably toaster does not exist.
SELECT drop_toaster('foo');
ERROR:  cannot find toaster with name "foo"
HINT:  Probably toaster does not exist.
SELECT drop_toaster('dummy');
ERROR:  toaster "dummy" is used and cannot be dropped
HINT:  Reset toaster for all columns it is used for.
SELECT drop_toaster('dummy');
ERROR:  toaster "dummy" is used and cannot be dropped
HINT:  Reset toaster for all columns it is used for.
SELECT reset_toaster('tab', 'b_comp');
 reset_toaster 
---------------
             0
(1 row)

SELECT drop_toaster('dummy') = :dummy_toaster_oid;
 ?column? 
----------
 t
(1 row)

SELECT drop_toaster('dummy');
ERROR:  cannot find toaster with name "dummy"
HINT:  Probably toaster does not exist.
-- test retoast
SELECT add_toaster('dummy', 'dummy_toaster_handler') <> 0;
 ?column? 
----------
 t
(1 row)

SELECT add_toaster('dummy2', 'dummy2_toaster_handler') <> 0;
 ?column? 
----------
 t
(1 row)

CREATE TABLE test_dummy_toaster(id int, data bytea);
SELECT set_toaster('dummy', 'test_dummy_toaster', 'data') <> 0;
 ?column? 
----------
 t
(1 row)

INSERT INTO test_dummy_toaster
SELECT id, repeat('a', 1000000)::bytea
FROM generate_series(1, 2) id;
INFO:  dummy_toaster_toast
INFO:  dummy_toaster_toast
SELECT pg_column_size(data) FROM test_dummy_toaster;
 pg_column_size 
----------------
             30
             30
(2 rows)

SELECT pg_column_size(data::text) FROM test_dummy_toaster;
INFO:  dummy_toaster_detoast
INFO:  dummy_toaster_detoast
 pg_column_size 
----------------
        2000006
        2000006
(2 rows)

SELECT substring(data, 999990, 20) FROM test_dummy_toaster;
INFO:  dummy_toaster_detoast
INFO:  dummy_toaster_detoast
        substring         
--------------------------
 \x6161616161616161616161
 \x6161616161616161616161
(2 rows)

-- detoast when copying to another table with default toaster
CREATE TABLE test_dummy_toaster2(id int, data bytea);
INSERT INTO test_dummy_toaster2
SELECT * FROM test_dummy_toaster;
INFO:  dummy_toaster_detoast
INFO:  dummy_toaster_detoast
SELECT pg_column_size(data) FROM test_dummy_toaster2;
 pg_column_size 
----------------
          11452
          11452
(2 rows)

SELECT pg_column_size(data::text) FROM test_dummy_toaster2;
 pg_column_size 
----------------
        2000006
        2000006
(2 rows)

SELECT substring(data, 999990, 20) FROM test_dummy_toaster2;
        substring         
--------------------------
 \x6161616161616161616161
 \x6161616161616161616161
(2 rows)

-- toaster.copy() is called when to another table with the same toaster
SELECT set_toaster('dummy', 'test_dummy_toaster2', 'data') <> 0;
 ?column? 
----------
 t
(1 row)

TRUNCATE test_dummy_toaster2;
INSERT INTO test_dummy_toaster2
SELECT * FROM test_dummy_toaster;
INFO:  dummy_toaster_copy
INFO:  dummy_toaster_detoast
INFO:  dummy_toaster_toast
INFO:  dummy_toaster_copy
INFO:  dummy_toaster_detoast
INFO:  dummy_toaster_toast
SELECT pg_column_size(data) FROM test_dummy_toaster2;
 pg_column_size 
----------------
             30
             30
(2 rows)

SELECT pg_column_size(data::text) FROM test_dummy_toaster2;
INFO:  dummy_toaster_detoast
INFO:  dummy_toaster_detoast
 pg_column_size 
----------------
        2000006
        2000006
(2 rows)

SELECT substring(data, 999990, 20) FROM test_dummy_toaster2;
INFO:  dummy_toaster_detoast
INFO:  dummy_toaster_detoast
        substring         
--------------------------
 \x6161616161616161616161
 \x6161616161616161616161
(2 rows)

-- detoast when copying to another table with different toaster
SELECT set_toaster('dummy2', 'test_dummy_toaster2', 'data') <> 0;
 ?column? 
----------
 t
(1 row)

TRUNCATE test_dummy_toaster2;
INSERT INTO test_dummy_toaster2
SELECT * FROM test_dummy_toaster;
INFO:  dummy_toaster_detoast
INFO:  dummy_toaster_toast
INFO:  dummy_toaster_detoast
INFO:  dummy_toaster_toast
SELECT pg_column_size(data) FROM test_dummy_toaster2;
 pg_column_size 
----------------
             30
             30
(2 rows)

SELECT pg_column_size(data::text) FROM test_dummy_toaster2;
INFO:  dummy_toaster_detoast
INFO:  dummy_toaster_detoast
 pg_column_size 
----------------
        2000006
        2000006
(2 rows)

SELECT substring(data, 999990, 20) FROM test_dummy_toaster2;
INFO:  dummy_toaster_detoast
INFO:  dummy_toaster_detoast
        substring         
--------------------------
 \x6161616161616161616161
 \x6161616161616161616161
(2 rows)

-- toaster.update() is called when copying to the same toaster
UPDATE test_dummy_toaster t1 SET data = (SELECT data FROM test_dummy_toaster t2 WHERE t2.id = 3 - t1.id);
INFO:  dummy_toaster_update
INFO:  dummy_toaster_detoast
INFO:  dummy_toaster_toast
INFO:  dummy_toaster_delete
INFO:  dummy_toaster_update
INFO:  dummy_toaster_detoast
INFO:  dummy_toaster_toast
INFO:  dummy_toaster_delete
SELECT pg_column_size(data) FROM test_dummy_toaster;
 pg_column_size 
----------------
             30
             30
(2 rows)

SELECT pg_column_size(data::text) FROM test_dummy_toaster;
INFO:  dummy_toaster_detoast
INFO:  dummy_toaster_detoast
 pg_column_size 
----------------
        2000006
        2000006
(2 rows)

SELECT substring(data, 999990, 20) FROM test_dummy_toaster;
INFO:  dummy_toaster_detoast
INFO:  dummy_toaster_detoast
        substring         
--------------------------
 \x6161616161616161616161
 \x6161616161616161616161
(2 rows)

-- retoast when copying with different toaster
SELECT set_toaster('dummy2', 'test_dummy_toaster', 'data') <> 0;
 ?column? 
----------
 t
(1 row)

UPDATE test_dummy_toaster t1 SET data = (SELECT data FROM test_dummy_toaster t2 WHERE t2.id = 3 - t1.id);
INFO:  dummy_toaster_detoast
INFO:  dummy_toaster_toast
INFO:  dummy_toaster_delete
INFO:  dummy_toaster_detoast
INFO:  dummy_toaster_toast
INFO:  dummy_toaster_delete
SELECT pg_column_size(data) FROM test_dummy_toaster;
 pg_column_size 
----------------
             30
             30
(2 rows)

SELECT pg_column_size(data::text) FROM test_dummy_toaster;
INFO:  dummy_toaster_detoast
INFO:  dummy_toaster_detoast
 pg_column_size 
----------------
        2000006
        2000006
(2 rows)

SELECT substring(data, 999990, 20) FROM test_dummy_toaster;
INFO:  dummy_toaster_detoast
INFO:  dummy_toaster_detoast
        substring         
--------------------------
 \x6161616161616161616161
 \x6161616161616161616161
(2 rows)

-- retoast with default toaster after toaster was reset
SELECT reset_toaster('test_dummy_toaster', 'data') <> 0;
 ?column? 
----------
 f
(1 row)

UPDATE test_dummy_toaster t1 SET data = (SELECT data FROM test_dummy_toaster t2 WHERE t2.id = 3 - t1.id);
INFO:  dummy_toaster_detoast
INFO:  dummy_toaster_delete
INFO:  dummy_toaster_detoast
INFO:  dummy_toaster_delete
SELECT pg_column_size(data) FROM test_dummy_toaster;
 pg_column_size 
----------------
          11452
          11452
(2 rows)

SELECT pg_column_size(data::text) FROM test_dummy_toaster;
 pg_column_size 
----------------
        2000006
        2000006
(2 rows)

SELECT substring(data, 999990, 20) FROM test_dummy_toaster;
        substring         
--------------------------
 \x6161616161616161616161
 \x6161616161616161616161
(2 rows)

SELECT reset_toaster('test_dummy_toaster2', 'data');
 reset_toaster 
---------------
             0
(1 row)

SELECT reset_toaster('test_dummy_toaster', 'data');
 reset_toaster 
---------------
             0
(1 row)

-- tests for using simple user
CREATE TABLE test_dummy_toaster3(id int, data bytea);
SELECT set_toaster('dummy', 'test_dummy_toaster3', 'data') <> 0;
 ?column? 
----------
 t
(1 row)

CREATE USER regress_toastapi_test_user;
GRANT ALL ON TABLE test_dummy_toaster3 TO regress_toastapi_test_user;
-- try to call toaster functions from simple user
SET SESSION AUTHORIZATION regress_toastapi_test_user;
-- ERROR:	permission denied to create toaster "dummy3"
SELECT add_toaster('dummy3', 'dummy_toaster_handler');
ERROR:  permission denied to create toaster "dummy3"
HINT:  Must be superuser to create a toaster.
-- ERROR:	permission denied to drop toaster "dummy"
SELECT drop_toaster('dummy');
ERROR:  permission denied to drop toaster "dummy"
HINT:  Must be superuser to drop a toaster.
-- ERROR:	permission denied to assign toaster "dummy2"
SELECT set_toaster('dummy2', 'test_dummy_toaster3', 'data');
ERROR:  permission denied to assign toaster "dummy2"
HINT:  Must be superuser to assign a toaster.
-- ERROR:	permission denied to reset toaster for table "test_dummy_toaster"
SELECT reset_toaster('test_dummy_toaster3', 'data');
ERROR:  permission denied to reset toaster for table "test_dummy_toaster3"
HINT:  Must be superuser to reset a toaster.
-- no ERROR
SELECT get_toaster_id('dummy') <> 0;
 ?column? 
----------
 t
(1 row)

SELECT get_toaster('test_dummy_toaster3', 'data') = get_toaster_id('dummy');
NOTICE:  dummy
 ?column? 
----------
 t
(1 row)

-- simple user can work with table
INSERT INTO test_dummy_toaster3
SELECT id, repeat('a', 1000000)::bytea
FROM generate_series(1, 2) id;
INFO:  dummy_toaster_toast
INFO:  dummy_toaster_toast
SELECT pg_column_size(data) FROM test_dummy_toaster3;
 pg_column_size 
----------------
             30
             30
(2 rows)

SELECT pg_column_size(data::text) FROM test_dummy_toaster3;
INFO:  dummy_toaster_detoast
INFO:  dummy_toaster_detoast
 pg_column_size 
----------------
        2000006
        2000006
(2 rows)

SELECT substring(data, 999990, 20) FROM test_dummy_toaster3;
INFO:  dummy_toaster_detoast
INFO:  dummy_toaster_detoast
        substring         
--------------------------
 \x6161616161616161616161
 \x6161616161616161616161
(2 rows)

RESET SESSION AUTHORIZATION;
-- cleanup
REVOKE CREATE ON DATABASE :"DBNAME" FROM regress_toastapi_test_user;
REVOKE USAGE ON SCHEMA public FROM regress_toastapi_test_user;
SELECT get_toaster_id('dummy2') = drop_toaster('dummy2');
 ?column? 
----------
 t
(1 row)

SELECT reset_toaster('test_dummy_toaster', 'data');
 reset_toaster 
---------------
             0
(1 row)

SELECT :dummy_toaster_oid = drop_toaster('dummy');
ERROR:  toaster "dummy" is used and cannot be dropped
HINT:  Reset toaster for all columns it is used for.
DROP TABLE test_dummy_toaster3;
DROP ROLE regress_toastapi_test_user;
-- ====================================================================
-- Schema-qualified toaster lookup (set_toaster handles "schema.name").
-- pg_toaster.tsrname stores unqualified names, but users may pass a
-- schema-qualified form (typically when a toaster's handler proc lives
-- in an extension installed outside the search path).  The lookup
-- splits on '.' and validates the prefix against the handler proc's
-- pronamespace.
-- ====================================================================
-- Register the handler proc explicitly in the pgpro_toast schema, then
-- add a toaster whose tsrname is unqualified.  This mirrors the layout
-- created by an extension installed outside the search path.
CREATE FUNCTION pgpro_toast.qualtest_handler(internal)
RETURNS internal AS '$libdir/toastapi', 'dummy_toaster_handler'
LANGUAGE C;
SELECT add_toaster('qualtest', 'pgpro_toast.qualtest_handler') > 0
       AS added;
 added 
-------
 t
(1 row)

-- Bare name still works (existing behaviour).
SELECT get_toaster_id('qualtest') > 0 AS bare_name_ok;
 bare_name_ok 
--------------
 t
(1 row)

-- Schema-qualified name resolves to the same toaster when the schema
-- matches the handler's pronamespace.
SELECT get_toaster_id('pgpro_toast.qualtest') > 0 AS qual_name_ok;
 qual_name_ok 
--------------
 t
(1 row)

SELECT get_toaster_id('qualtest') = get_toaster_id('pgpro_toast.qualtest')
       AS bare_eq_qual;
 bare_eq_qual 
--------------
 t
(1 row)

-- Wrong schema prefix is correctly rejected.
SELECT get_toaster_id('public.qualtest') AS wrong_schema_returns_zero;
 wrong_schema_returns_zero 
---------------------------
                         0
(1 row)

-- set_toaster with schema-qualified name attaches successfully.
CREATE TABLE qualtest_tbl (id int, data bytea);
ALTER TABLE qualtest_tbl ALTER data SET STORAGE EXTERNAL;
SELECT set_toaster('pgpro_toast.qualtest', 'qualtest_tbl', 'data') > 0
       AS qual_set_toaster_ok;
ERROR:  toaster "qualtest" supports only STORAGE EXTENDED
-- Cleanup
SELECT reset_toaster('qualtest_tbl', 'data');
 reset_toaster 
---------------
             0
(1 row)

DROP TABLE qualtest_tbl;
SELECT drop_toaster('qualtest') > 0 AS dropped;
 dropped 
---------
 t
(1 row)

DROP FUNCTION pgpro_toast.qualtest_handler(internal);
DROP EXTENSION toastapi;
