CREATE EXTENSION toastapi;
CREATE EXTENSION bytea_toaster;
--
-- Test failure
--
CREATE TABLE tst_fail (t bytea);
-- Must fail
SELECT pgpro_toast.set_toaster('bytea_toaster', 'tst_fail', 't');
ERROR:  "bytea_toaster" supports only type "bytea" and uncompressed storage
DROP TABLE tst_fail;
--
-- Test bytea_toaster
--
-- Get bytea_toaster OID
SELECT pgpro_toast.get_toaster_id('bytea_toaster') AS bytea_toaster_oid
\gset
CREATE TABLE test_bytea_append (id int, a bytea);
ALTER TABLE test_bytea_append ALTER a SET STORAGE external;
-- Must return bytea_toaster OID
SELECT pgpro_toast.set_toaster('bytea_toaster', 'test_bytea_append', 'a') = :bytea_toaster_oid;
 ?column? 
----------
 t
(1 row)

INSERT INTO test_bytea_append SELECT i, repeat('a', 10000)::bytea FROM generate_series(1, 10) i;
SELECT id, a = repeat('a', 10000)::bytea FROM test_bytea_append ORDER BY id;
 id | ?column? 
----+----------
  1 | t
  2 | t
  3 | t
  4 | t
  5 | t
  6 | t
  7 | t
  8 | t
  9 | t
 10 | t
(10 rows)

SELECT id, convert_from(substr(a,    1, 100), 'UTF8') FROM test_bytea_append ORDER BY id;
 id |                                             convert_from                                             
----+------------------------------------------------------------------------------------------------------
  1 | aaaaaaaaaaaaaaaaaaaaaaaaaaaaaaaaaaaaaaaaaaaaaaaaaaaaaaaaaaaaaaaaaaaaaaaaaaaaaaaaaaaaaaaaaaaaaaaaaaaa
  2 | aaaaaaaaaaaaaaaaaaaaaaaaaaaaaaaaaaaaaaaaaaaaaaaaaaaaaaaaaaaaaaaaaaaaaaaaaaaaaaaaaaaaaaaaaaaaaaaaaaaa
  3 | aaaaaaaaaaaaaaaaaaaaaaaaaaaaaaaaaaaaaaaaaaaaaaaaaaaaaaaaaaaaaaaaaaaaaaaaaaaaaaaaaaaaaaaaaaaaaaaaaaaa
  4 | aaaaaaaaaaaaaaaaaaaaaaaaaaaaaaaaaaaaaaaaaaaaaaaaaaaaaaaaaaaaaaaaaaaaaaaaaaaaaaaaaaaaaaaaaaaaaaaaaaaa
  5 | aaaaaaaaaaaaaaaaaaaaaaaaaaaaaaaaaaaaaaaaaaaaaaaaaaaaaaaaaaaaaaaaaaaaaaaaaaaaaaaaaaaaaaaaaaaaaaaaaaaa
  6 | aaaaaaaaaaaaaaaaaaaaaaaaaaaaaaaaaaaaaaaaaaaaaaaaaaaaaaaaaaaaaaaaaaaaaaaaaaaaaaaaaaaaaaaaaaaaaaaaaaaa
  7 | aaaaaaaaaaaaaaaaaaaaaaaaaaaaaaaaaaaaaaaaaaaaaaaaaaaaaaaaaaaaaaaaaaaaaaaaaaaaaaaaaaaaaaaaaaaaaaaaaaaa
  8 | aaaaaaaaaaaaaaaaaaaaaaaaaaaaaaaaaaaaaaaaaaaaaaaaaaaaaaaaaaaaaaaaaaaaaaaaaaaaaaaaaaaaaaaaaaaaaaaaaaaa
  9 | aaaaaaaaaaaaaaaaaaaaaaaaaaaaaaaaaaaaaaaaaaaaaaaaaaaaaaaaaaaaaaaaaaaaaaaaaaaaaaaaaaaaaaaaaaaaaaaaaaaa
 10 | aaaaaaaaaaaaaaaaaaaaaaaaaaaaaaaaaaaaaaaaaaaaaaaaaaaaaaaaaaaaaaaaaaaaaaaaaaaaaaaaaaaaaaaaaaaaaaaaaaaa
(10 rows)

SELECT id, convert_from(substr(a, 9901, 200), 'UTF8') FROM test_bytea_append ORDER BY id;
 id |                                             convert_from                                             
----+------------------------------------------------------------------------------------------------------
  1 | aaaaaaaaaaaaaaaaaaaaaaaaaaaaaaaaaaaaaaaaaaaaaaaaaaaaaaaaaaaaaaaaaaaaaaaaaaaaaaaaaaaaaaaaaaaaaaaaaaaa
  2 | aaaaaaaaaaaaaaaaaaaaaaaaaaaaaaaaaaaaaaaaaaaaaaaaaaaaaaaaaaaaaaaaaaaaaaaaaaaaaaaaaaaaaaaaaaaaaaaaaaaa
  3 | aaaaaaaaaaaaaaaaaaaaaaaaaaaaaaaaaaaaaaaaaaaaaaaaaaaaaaaaaaaaaaaaaaaaaaaaaaaaaaaaaaaaaaaaaaaaaaaaaaaa
  4 | aaaaaaaaaaaaaaaaaaaaaaaaaaaaaaaaaaaaaaaaaaaaaaaaaaaaaaaaaaaaaaaaaaaaaaaaaaaaaaaaaaaaaaaaaaaaaaaaaaaa
  5 | aaaaaaaaaaaaaaaaaaaaaaaaaaaaaaaaaaaaaaaaaaaaaaaaaaaaaaaaaaaaaaaaaaaaaaaaaaaaaaaaaaaaaaaaaaaaaaaaaaaa
  6 | aaaaaaaaaaaaaaaaaaaaaaaaaaaaaaaaaaaaaaaaaaaaaaaaaaaaaaaaaaaaaaaaaaaaaaaaaaaaaaaaaaaaaaaaaaaaaaaaaaaa
  7 | aaaaaaaaaaaaaaaaaaaaaaaaaaaaaaaaaaaaaaaaaaaaaaaaaaaaaaaaaaaaaaaaaaaaaaaaaaaaaaaaaaaaaaaaaaaaaaaaaaaa
  8 | aaaaaaaaaaaaaaaaaaaaaaaaaaaaaaaaaaaaaaaaaaaaaaaaaaaaaaaaaaaaaaaaaaaaaaaaaaaaaaaaaaaaaaaaaaaaaaaaaaaa
  9 | aaaaaaaaaaaaaaaaaaaaaaaaaaaaaaaaaaaaaaaaaaaaaaaaaaaaaaaaaaaaaaaaaaaaaaaaaaaaaaaaaaaaaaaaaaaaaaaaaaaa
 10 | aaaaaaaaaaaaaaaaaaaaaaaaaaaaaaaaaaaaaaaaaaaaaaaaaaaaaaaaaaaaaaaaaaaaaaaaaaaaaaaaaaaaaaaaaaaaaaaaaaaa
(10 rows)

BEGIN TRANSACTION ISOLATION LEVEL REPEATABLE READ;
SAVEPOINT p1;
UPDATE test_bytea_append SET a = a || repeat('b', 3000)::bytea;
SELECT id, length(convert_from(a, 'UTF8')), convert_from(substr(a, 9990, 20) || substr(a, 12990, 20), 'UTF8') FROM test_bytea_append;
 id | length |          convert_from           
----+--------+---------------------------------
  1 |  13000 | aaaaaaaaaaabbbbbbbbbbbbbbbbbbbb
  2 |  13000 | aaaaaaaaaaabbbbbbbbbbbbbbbbbbbb
  3 |  13000 | aaaaaaaaaaabbbbbbbbbbbbbbbbbbbb
  4 |  13000 | aaaaaaaaaaabbbbbbbbbbbbbbbbbbbb
  5 |  13000 | aaaaaaaaaaabbbbbbbbbbbbbbbbbbbb
  6 |  13000 | aaaaaaaaaaabbbbbbbbbbbbbbbbbbbb
  7 |  13000 | aaaaaaaaaaabbbbbbbbbbbbbbbbbbbb
  8 |  13000 | aaaaaaaaaaabbbbbbbbbbbbbbbbbbbb
  9 |  13000 | aaaaaaaaaaabbbbbbbbbbbbbbbbbbbb
 10 |  13000 | aaaaaaaaaaabbbbbbbbbbbbbbbbbbbb
(10 rows)

SAVEPOINT p2;
UPDATE test_bytea_append SET a = a || repeat('c', 2000)::bytea;
SELECT id, length(convert_from(a, 'UTF8')), convert_from(substr(a, 9990, 20) || substr(a, 12990, 20) ||  substr(a, 14990, 20), 'UTF8') FROM test_bytea_append;
 id | length |                    convert_from                     
----+--------+-----------------------------------------------------
  1 |  15000 | aaaaaaaaaaabbbbbbbbbbbbbbbbbbbbcccccccccccccccccccc
  2 |  15000 | aaaaaaaaaaabbbbbbbbbbbbbbbbbbbbcccccccccccccccccccc
  3 |  15000 | aaaaaaaaaaabbbbbbbbbbbbbbbbbbbbcccccccccccccccccccc
  4 |  15000 | aaaaaaaaaaabbbbbbbbbbbbbbbbbbbbcccccccccccccccccccc
  5 |  15000 | aaaaaaaaaaabbbbbbbbbbbbbbbbbbbbcccccccccccccccccccc
  6 |  15000 | aaaaaaaaaaabbbbbbbbbbbbbbbbbbbbcccccccccccccccccccc
  7 |  15000 | aaaaaaaaaaabbbbbbbbbbbbbbbbbbbbcccccccccccccccccccc
  8 |  15000 | aaaaaaaaaaabbbbbbbbbbbbbbbbbbbbcccccccccccccccccccc
  9 |  15000 | aaaaaaaaaaabbbbbbbbbbbbbbbbbbbbcccccccccccccccccccc
 10 |  15000 | aaaaaaaaaaabbbbbbbbbbbbbbbbbbbbcccccccccccccccccccc
(10 rows)

ROLLBACK TO SAVEPOINT p2;
SELECT id, length(convert_from(a, 'UTF8')), convert_from(substr(a, 9990, 20) || substr(a, 12990, 20), 'UTF8') FROM test_bytea_append;
 id | length |          convert_from           
----+--------+---------------------------------
  1 |  13000 | aaaaaaaaaaabbbbbbbbbbbbbbbbbbbb
  2 |  13000 | aaaaaaaaaaabbbbbbbbbbbbbbbbbbbb
  3 |  13000 | aaaaaaaaaaabbbbbbbbbbbbbbbbbbbb
  4 |  13000 | aaaaaaaaaaabbbbbbbbbbbbbbbbbbbb
  5 |  13000 | aaaaaaaaaaabbbbbbbbbbbbbbbbbbbb
  6 |  13000 | aaaaaaaaaaabbbbbbbbbbbbbbbbbbbb
  7 |  13000 | aaaaaaaaaaabbbbbbbbbbbbbbbbbbbb
  8 |  13000 | aaaaaaaaaaabbbbbbbbbbbbbbbbbbbb
  9 |  13000 | aaaaaaaaaaabbbbbbbbbbbbbbbbbbbb
 10 |  13000 | aaaaaaaaaaabbbbbbbbbbbbbbbbbbbb
(10 rows)

UPDATE test_bytea_append SET a = a || repeat('d', 4000)::bytea;
SELECT id, length(convert_from(a, 'UTF8')), convert_from(substr(a, 9990, 20) || substr(a, 12990, 20) || substr(a, 16990, 20), 'UTF8') FROM test_bytea_append;
 id | length |                    convert_from                     
----+--------+-----------------------------------------------------
  1 |  17000 | aaaaaaaaaaabbbbbbbbbbbbbbbbbbbbdddddddddddddddddddd
  2 |  17000 | aaaaaaaaaaabbbbbbbbbbbbbbbbbbbbdddddddddddddddddddd
  3 |  17000 | aaaaaaaaaaabbbbbbbbbbbbbbbbbbbbdddddddddddddddddddd
  4 |  17000 | aaaaaaaaaaabbbbbbbbbbbbbbbbbbbbdddddddddddddddddddd
  5 |  17000 | aaaaaaaaaaabbbbbbbbbbbbbbbbbbbbdddddddddddddddddddd
  6 |  17000 | aaaaaaaaaaabbbbbbbbbbbbbbbbbbbbdddddddddddddddddddd
  7 |  17000 | aaaaaaaaaaabbbbbbbbbbbbbbbbbbbbdddddddddddddddddddd
  8 |  17000 | aaaaaaaaaaabbbbbbbbbbbbbbbbbbbbdddddddddddddddddddd
  9 |  17000 | aaaaaaaaaaabbbbbbbbbbbbbbbbbbbbdddddddddddddddddddd
 10 |  17000 | aaaaaaaaaaabbbbbbbbbbbbbbbbbbbbdddddddddddddddddddd
(10 rows)

ROLLBACK TO SAVEPOINT p1;
SELECT id, length(convert_from(a, 'UTF8')), convert_from(substr(a, 9990, 20) || substr(a, 12990, 20), 'UTF8') FROM test_bytea_append;
 id | length | convert_from 
----+--------+--------------
  1 |  10000 | aaaaaaaaaaa
  2 |  10000 | aaaaaaaaaaa
  3 |  10000 | aaaaaaaaaaa
  4 |  10000 | aaaaaaaaaaa
  5 |  10000 | aaaaaaaaaaa
  6 |  10000 | aaaaaaaaaaa
  7 |  10000 | aaaaaaaaaaa
  8 |  10000 | aaaaaaaaaaa
  9 |  10000 | aaaaaaaaaaa
 10 |  10000 | aaaaaaaaaaa
(10 rows)

UPDATE test_bytea_append SET a = a || repeat('e', 5000)::bytea;
SELECT id, length(convert_from(a, 'UTF8')), convert_from(substr(a, 9990, 20) || substr(a, 14990, 20), 'UTF8') FROM test_bytea_append;
 id | length |          convert_from           
----+--------+---------------------------------
  1 |  15000 | aaaaaaaaaaaeeeeeeeeeeeeeeeeeeee
  2 |  15000 | aaaaaaaaaaaeeeeeeeeeeeeeeeeeeee
  3 |  15000 | aaaaaaaaaaaeeeeeeeeeeeeeeeeeeee
  4 |  15000 | aaaaaaaaaaaeeeeeeeeeeeeeeeeeeee
  5 |  15000 | aaaaaaaaaaaeeeeeeeeeeeeeeeeeeee
  6 |  15000 | aaaaaaaaaaaeeeeeeeeeeeeeeeeeeee
  7 |  15000 | aaaaaaaaaaaeeeeeeeeeeeeeeeeeeee
  8 |  15000 | aaaaaaaaaaaeeeeeeeeeeeeeeeeeeee
  9 |  15000 | aaaaaaaaaaaeeeeeeeeeeeeeeeeeeee
 10 |  15000 | aaaaaaaaaaaeeeeeeeeeeeeeeeeeeee
(10 rows)

COMMIT;
SELECT id, length(convert_from(a, 'UTF8')), convert_from(substr(a, 9990, 20) || substr(a, 14990, 20), 'UTF8') FROM test_bytea_append;
 id | length |          convert_from           
----+--------+---------------------------------
  1 |  15000 | aaaaaaaaaaaeeeeeeeeeeeeeeeeeeee
  2 |  15000 | aaaaaaaaaaaeeeeeeeeeeeeeeeeeeee
  3 |  15000 | aaaaaaaaaaaeeeeeeeeeeeeeeeeeeee
  4 |  15000 | aaaaaaaaaaaeeeeeeeeeeeeeeeeeeee
  5 |  15000 | aaaaaaaaaaaeeeeeeeeeeeeeeeeeeee
  6 |  15000 | aaaaaaaaaaaeeeeeeeeeeeeeeeeeeee
  7 |  15000 | aaaaaaaaaaaeeeeeeeeeeeeeeeeeeee
  8 |  15000 | aaaaaaaaaaaeeeeeeeeeeeeeeeeeeee
  9 |  15000 | aaaaaaaaaaaeeeeeeeeeeeeeeeeeeee
 10 |  15000 | aaaaaaaaaaaeeeeeeeeeeeeeeeeeeee
(10 rows)

UPDATE test_bytea_append SET a = NULL WHERE id < 3;
UPDATE test_bytea_append SET a = 'foo' WHERE id < 5;
VACUUM FULL test_bytea_append;
SELECT id, length(convert_from(a, 'UTF8')), convert_from(substr(a, 9990, 20) || substr(a, 14990, 20), 'UTF8') FROM test_bytea_append ORDER BY id;
 id | length |          convert_from           
----+--------+---------------------------------
  1 |      3 | 
  2 |      3 | 
  3 |      3 | 
  4 |      3 | 
  5 |  15000 | aaaaaaaaaaaeeeeeeeeeeeeeeeeeeee
  6 |  15000 | aaaaaaaaaaaeeeeeeeeeeeeeeeeeeee
  7 |  15000 | aaaaaaaaaaaeeeeeeeeeeeeeeeeeeee
  8 |  15000 | aaaaaaaaaaaeeeeeeeeeeeeeeeeeeee
  9 |  15000 | aaaaaaaaaaaeeeeeeeeeeeeeeeeeeee
 10 |  15000 | aaaaaaaaaaaeeeeeeeeeeeeeeeeeeee
(10 rows)

TRUNCATE test_bytea_append;
INSERT INTO test_bytea_append SELECT i, repeat('a', 10000)::bytea FROM generate_series(1, 10) i;
BEGIN TRANSACTION ISOLATION LEVEL REPEATABLE READ;
UPDATE test_bytea_append SET a = a || repeat('b', 3000)::bytea;
SELECT id, convert_from(substr(a, 9990, 20) || substr(a, 12990, 20), 'UTF8') FROM test_bytea_append;
 id |          convert_from           
----+---------------------------------
  1 | aaaaaaaaaaabbbbbbbbbbbbbbbbbbbb
  2 | aaaaaaaaaaabbbbbbbbbbbbbbbbbbbb
  3 | aaaaaaaaaaabbbbbbbbbbbbbbbbbbbb
  4 | aaaaaaaaaaabbbbbbbbbbbbbbbbbbbb
  5 | aaaaaaaaaaabbbbbbbbbbbbbbbbbbbb
  6 | aaaaaaaaaaabbbbbbbbbbbbbbbbbbbb
  7 | aaaaaaaaaaabbbbbbbbbbbbbbbbbbbb
  8 | aaaaaaaaaaabbbbbbbbbbbbbbbbbbbb
  9 | aaaaaaaaaaabbbbbbbbbbbbbbbbbbbb
 10 | aaaaaaaaaaabbbbbbbbbbbbbbbbbbbb
(10 rows)

UPDATE test_bytea_append SET a = a || repeat('c', 2000)::bytea;
SELECT id, convert_from(substr(a, 9990, 20) || substr(a, 12990, 20) || substr(a, 14990, 20), 'UTF8') FROM test_bytea_append;
 id |                    convert_from                     
----+-----------------------------------------------------
  1 | aaaaaaaaaaabbbbbbbbbbbbbbbbbbbbcccccccccccccccccccc
  2 | aaaaaaaaaaabbbbbbbbbbbbbbbbbbbbcccccccccccccccccccc
  3 | aaaaaaaaaaabbbbbbbbbbbbbbbbbbbbcccccccccccccccccccc
  4 | aaaaaaaaaaabbbbbbbbbbbbbbbbbbbbcccccccccccccccccccc
  5 | aaaaaaaaaaabbbbbbbbbbbbbbbbbbbbcccccccccccccccccccc
  6 | aaaaaaaaaaabbbbbbbbbbbbbbbbbbbbcccccccccccccccccccc
  7 | aaaaaaaaaaabbbbbbbbbbbbbbbbbbbbcccccccccccccccccccc
  8 | aaaaaaaaaaabbbbbbbbbbbbbbbbbbbbcccccccccccccccccccc
  9 | aaaaaaaaaaabbbbbbbbbbbbbbbbbbbbcccccccccccccccccccc
 10 | aaaaaaaaaaabbbbbbbbbbbbbbbbbbbbcccccccccccccccccccc
(10 rows)

UPDATE test_bytea_append SET a = a || repeat('d', 4000)::bytea;
SELECT id, convert_from(substr(a, 9990, 20) || substr(a, 12990, 20) || substr(a, 14990, 20) || substr(a, 18990, 20), 'UTF8') FROM test_bytea_append;
 id |                              convert_from                               
----+-------------------------------------------------------------------------
  1 | aaaaaaaaaaabbbbbbbbbbbbbbbbbbbbccccccccccccccccccccdddddddddddddddddddd
  2 | aaaaaaaaaaabbbbbbbbbbbbbbbbbbbbccccccccccccccccccccdddddddddddddddddddd
  3 | aaaaaaaaaaabbbbbbbbbbbbbbbbbbbbccccccccccccccccccccdddddddddddddddddddd
  4 | aaaaaaaaaaabbbbbbbbbbbbbbbbbbbbccccccccccccccccccccdddddddddddddddddddd
  5 | aaaaaaaaaaabbbbbbbbbbbbbbbbbbbbccccccccccccccccccccdddddddddddddddddddd
  6 | aaaaaaaaaaabbbbbbbbbbbbbbbbbbbbccccccccccccccccccccdddddddddddddddddddd
  7 | aaaaaaaaaaabbbbbbbbbbbbbbbbbbbbccccccccccccccccccccdddddddddddddddddddd
  8 | aaaaaaaaaaabbbbbbbbbbbbbbbbbbbbccccccccccccccccccccdddddddddddddddddddd
  9 | aaaaaaaaaaabbbbbbbbbbbbbbbbbbbbccccccccccccccccccccdddddddddddddddddddd
 10 | aaaaaaaaaaabbbbbbbbbbbbbbbbbbbbccccccccccccccccccccdddddddddddddddddddd
(10 rows)

CREATE FUNCTION test_bytea_append_func() RETURNS void AS
$$
DECLARE
  a0 bytea;
  a1 bytea;
  a2 bytea;
  a3 bytea;
BEGIN
  TRUNCATE test_bytea_append;
  INSERT INTO test_bytea_append SELECT i, repeat('a', 10000)::bytea FROM generate_series(1, 10) i;
  SELECT a INTO a0 FROM test_bytea_append LIMIT 1;

  UPDATE test_bytea_append SET a = a || repeat('b', 3000)::bytea;
  SELECT a INTO a1 FROM test_bytea_append LIMIT 1;

  UPDATE test_bytea_append SET a = a || repeat('c', 2000)::bytea;
  SELECT a INTO a2 FROM test_bytea_append LIMIT 1;

  UPDATE test_bytea_append SET a = a || repeat('d', 4000)::bytea;
  SELECT a INTO a3 FROM test_bytea_append LIMIT 1;

  RAISE NOTICE '%', convert_from(substr(a0, 9990, 20), 'UTF8');
  RAISE NOTICE '%', convert_from(substr(a1, 9990, 20) || substr(a1, 12990, 20), 'UTF8');
  RAISE NOTICE '%', convert_from(substr(a2, 9990, 20) || substr(a2, 12990, 20) || substr(a2, 14990, 20), 'UTF8');
  RAISE NOTICE '%', convert_from(substr(a3, 9990, 20) || substr(a3, 12990, 20) || substr(a3, 14990, 20) || substr(a3, 18990, 20), 'UTF8');
END;
$$ LANGUAGE plpgsql;
SELECT test_bytea_append_func();
NOTICE:  aaaaaaaaaaa
NOTICE:  aaaaaaaaaaabbbbbbbbbbbbbbbbbbbb
NOTICE:  aaaaaaaaaaabbbbbbbbbbbbbbbbbbbbcccccccccccccccccccc
NOTICE:  aaaaaaaaaaabbbbbbbbbbbbbbbbbbbbccccccccccccccccccccdddddddddddddddddddd
 test_bytea_append_func 
------------------------
 
(1 row)

COMMIT;
-- Must return bytea_toaster OID
SELECT pgpro_toast.get_toaster('test_bytea_append', 'a') = :bytea_toaster_oid;
NOTICE:  bytea_toaster
 ?column? 
----------
 t
(1 row)

SELECT pgpro_toast.reset_toaster('test_bytea_append', 'a');
 reset_toaster 
---------------
             0
(1 row)

--
-- Cleanup
--
DROP TABLE test_bytea_append;
-- Must return bytea_toaster OID
SELECT pgpro_toast.drop_toaster('bytea_toaster') = :bytea_toaster_oid;
 ?column? 
----------
 t
(1 row)

DROP FUNCTION test_bytea_append_func;
DROP EXTENSION bytea_toaster;
DROP EXTENSION toastapi;
